{"views":[{"id":"front","direction":[0,0,1],"up":[0,1,0]}],"output_outline":false,"output_detail":true,"output_bbox":false,"model_transform":[1,0,0,0,0,1,0,0,0,0,1,0,0,0,0,1],"strip_root_placement":true,"curve_mode":"polyline","samples_per_curve":32,"round_digits":6,"edge_v_sharp":false,"edge_v_outline":true,"edge_v_smooth":true,"edge_v_sewn":true,"edge_v_iso":true,"edge_h_sharp":true,"edge_h_outline":true,"edge_h_smooth":true,"edge_h_sewn":true,"edge_h_iso":true,"union_outline_polygons":false,"projection_algorithm":"fast","mesh_linear_deflection":0.02,"mesh_angular_deflection":0.25,"mesh_relative":true,"mesh_deflection_mode":"absolute","mesh_deflection_coefficient":0.002,"outline_algorithm":"fast-mesh-shadow","hlr_angle_tolerance":0.01,"fast":{"include_boundaries":false,"include_creases":true,"include_silhouettes":false,"include_hidden":true,"suppress_coplanar_seams":true,"crease_angle_rad":0.25,"weld_tolerance":0.000001,"projected_tolerance":0.000002,"depth_tolerance":0.000003,"coplanar_seam_angle_rad":0.01,"coplanar_seam_depth_tolerance":0.000004,"coplanar_seam_lateral_tolerance":0.000005,"limits":{"max_vertices":1000,"max_triangles":2000,"max_edges":3000,"max_grid_references":4000,"max_candidate_pairs":5000,"max_fragments":6000,"max_output_segments":7000}}}
